{
  "version": "1.0",
  "last_scan": "2026-04-29T06:27:02.813962Z",
  "run_type": "full",
  "modules": {
    "app/database.py": {
      "hash": "fb35ff0d26985c2047a115b0a9ed138d85f945895f2d217402878765b4a9a059",
      "tests_generated": [],
      "last_updated": "2026-04-29T06:27:02.813962Z"
    },
    "app/main.py": {
      "hash": "4230de2cafc4cac6a10c3cc7cd0515519719253d398d02d5cfbc9d18d8c62e8c",
      "tests_generated": [],
      "last_updated": "2026-04-29T06:27:02.813962Z"
    },
    "app/models/user.py": {
      "hash": "83369d01eaedb1186a0668f62136141495757673f8f30d1fa20867ee7a5520ba",
      "tests_generated": [],
      "last_updated": "2026-04-29T06:27:02.813962Z"
    },
    "app/routes/auth.py": {
      "hash": "e835a43e1ec898e3ba5000b17f38934a6b2a6214eb36ff36c20d6dde23944959",
      "tests_generated": [
        "tests/api/test_auth.py",
        "tests/security/test_auth_security.py"
      ],
      "last_updated": "2026-04-29T06:27:02.813962Z"
    },
    "app/routes/users.py": {
      "hash": "08ecdcc99f40e3d2ccfa7c7b4cbd88dff4d49a08dfba37806781c9db2ba05517",
      "tests_generated": [
        "tests/api/test_users.py",
        "tests/security/test_injection.py",
        "tests/security/test_exposure.py"
      ],
      "last_updated": "2026-04-29T06:27:02.813962Z"
    },
    "app/services/user_service.py": {
      "hash": "bd19beceea371ad7bc580c3965c9db3cd71f65e33563589325a9433ad65083af",
      "tests_generated": [
        "tests/unit/services/test_user_service.py"
      ],
      "last_updated": "2026-04-29T06:27:02.813962Z"
    }
  }
}