{
  "version": "1.0",
  "last_scan": "2026-04-28T13:23:46.168061Z",
  "run_type": "full",
  "modules": {
    "src/app.ts": {
      "hash": "79abdc36cd33",
      "tests_generated": [],
      "last_updated": "2026-04-28T13:23:46.168061Z"
    },
    "src/routes/auth.ts": {
      "hash": "56d6cc8c6cab",
      "tests_generated": [
        "tests/api/auth.api.test.ts"
      ],
      "last_updated": "2026-04-28T13:23:46.168061Z"
    },
    "src/routes/users.ts": {
      "hash": "6a874f4ca78b",
      "tests_generated": [
        "tests/api/users.api.test.ts"
      ],
      "last_updated": "2026-04-28T13:23:46.168061Z"
    },
    "src/services/userService.ts": {
      "hash": "d667c8ee62ab",
      "tests_generated": [
        "tests/unit/services/userService.test.ts",
        "tests/security/auth.security.test.ts"
      ],
      "last_updated": "2026-04-28T13:23:46.168061Z"
    },
    "src/middleware/auth.ts": {
      "hash": "27a5ef9d0a38",
      "tests_generated": [
        "tests/unit/middleware/auth.test.ts"
      ],
      "last_updated": "2026-04-28T13:23:46.168061Z"
    },
    "src/models/User.ts": {
      "hash": "132dfd7ca6c2",
      "tests_generated": [],
      "last_updated": "2026-04-28T13:23:46.168061Z"
    },
    "src/models/db.ts": {
      "hash": "a7b87811c1f5",
      "tests_generated": [],
      "last_updated": "2026-04-28T13:23:46.168061Z"
    },
    "src/components/LoginForm.tsx": {
      "hash": "4efaf91f03cc",
      "tests_generated": [],
      "last_updated": "2026-04-28T13:23:46.168061Z"
    }
  }
}